{
  "schema": "tdep/0.1",
  "availability_id": "12121212-1212-4121-8121-121212121212",
  "face_id": "66666666-6666-4666-8666-666666666666",
  "seller_partner_id": "77777777-7777-4777-8777-777777777777",
  "cedible": true,
  "windows": [
    {
      "from": "2026-08-23T08:00:00.000Z",
      "until": "2026-08-23T22:00:00.000Z"
    }
  ],
  "cap_share_pct": 10,
  "max_plays_per_day": 200
}
