{
  "schema": "tdep/0.1",
  "availability_id": "11111111-1111-4111-8111-111111111111",
  "face_id": "aaaaaaaa-aaaa-4aaa-8aaa-aaaaaaaaaaaa",
  "seller_partner_id": "bbbbbbbb-bbbb-4bbb-8bbb-bbbbbbbbbbbb",
  "cedible": true,
  "windows": [
    {
      "from": "2026-08-23T08:00:00.000Z",
      "until": "2026-08-23T22:00:00.000Z"
    }
  ],
  "cap_share_pct": 10,
  "max_plays_per_day": 120
}
